{
  "id": "bev-car",
  "schemaVersion": 1,
  "name": "Battery Electric Car",
  "description": "Compact electric car modelled on the 2021 Cupra Born 58 kWh (VW ID.3 class), with the values of FASTSim's vehicle file (Apache-2.0): 1,927 kg, Cd 0.27, 2.31 m², 150 kW e-motor, 62 kWh battery with 58 kWh usable, 0.25 kW auxiliaries. HV battery → e-motor (its loss map holds the inverter's losses; there is no inverter part) → single-speed reduction gear → wheels, driven over a speed profile.\nWhat to expect (energy at the battery terminals):\n• WLTC Class 3b: 14.1 kWh/100 km, 16.3 at the charging socket (a car of this class is rated about 15–16 kWh/100 km at the socket)\n• WLTC with heating/air-con on (2.5 kW): 18.9 kWh/100 km\n• WLTC on a winter day (−7 °C, heating 2.5 kW): 19.5 kWh/100 km; on a hot day (35 °C, air-con 2.5 kW): 18.6 (only the air's density follows the weather; the heating and air-con power is a fixed assumption)\n• City Cycle (a hand-made demo profile, not a standard cycle): 11.1 kWh/100 km\n• Full power: 0–100 km/h in 7.1 s, top speed 160 km/h (Cupra: 7.3 s, 160 km/h)",
  "card": {
    "question": "How much energy does a compact electric car use in the city, on the WLTC, and with the heating on?",
    "tags": [
      "battery electric",
      "energy use",
      "drive cycles",
      "WLTC"
    ],
    "difficulty": "beginner",
    "runTimeS": 10,
    "learn": [
      "Read the energy per 100 km and the battery's state of charge after a cycle",
      "See what an auxiliary load such as heating costs on a cycle",
      "Compare two runs of one car"
    ],
    "status": "plausibility-checked",
    "features": [
      "Driving Task with a bundled drive cycle",
      "Battery, E-Motor, single-speed reduction gear",
      "Auxiliary load (Power Consumer)",
      "Live run at 10× real time"
    ],
    "author": "LightSim",
    "version": "0.3.0",
    "licence": "LightSim's own (LICENSE); vehicle values from FASTSim (Apache-2.0), see the data register DR-01",
    "narrative": [
      "0 s: the car starts at 90 % charge, standing.",
      "On the City Cycle it accelerates to 50 km/h, cruises and stops twice; braking recuperates energy into the battery.",
      "On the WLTC it drives four phases, Low, Medium, High and Extra High, up to 131 km/h; the air drag of the Extra High phase uses the most energy.",
      "With the heating/air-con on, the 2.5 kW load runs the whole 1,800 s and adds about 4.8 kWh/100 km."
    ]
  },
  "systems": [
    {
      "id": "sys-root",
      "name": "Battery Electric Car",
      "parentId": null,
      "elements": [
        {
          "id": "el-wheel-rl",
          "componentDefId": "propulsion.wheel",
          "label": "Wheel RL",
          "position": {
            "x": 40,
            "y": 30
          },
          "parameterOverrides": {
            "radius_m": 0.3488,
            "inertia_kgm2": 0.815,
            "rolling_resistance": 0.011,
            "vehicle_load_share_pct": 19.5,
            "axle": "Rear"
          },
          "parameterSources": {
            "radius_m": {
              "source": "FASTSim 2.1.5 2021_Cupra_Born.csv (Apache-2.0; it cites automobile-catalog.com and carexpert.com.au); docs/data-register.csv DR-01",
              "kind": "datasheet",
              "confidence": 1
            },
            "inertia_kgm2": {
              "source": "FASTSim 2.1.5 2021_Cupra_Born.csv (Apache-2.0; it cites automobile-catalog.com and carexpert.com.au); docs/data-register.csv DR-01",
              "kind": "datasheet",
              "confidence": 1
            },
            "rolling_resistance": {
              "source": "FASTSim 2.1.5 2021_Cupra_Born.csv (Apache-2.0; it cites automobile-catalog.com and carexpert.com.au); docs/data-register.csv DR-01",
              "kind": "datasheet",
              "confidence": 1
            },
            "vehicle_load_share_pct": {
              "source": "FASTSim 2.1.5 2021_Cupra_Born.csv (Apache-2.0; it cites automobile-catalog.com and carexpert.com.au); docs/data-register.csv DR-01",
              "kind": "datasheet",
              "confidence": 1,
              "note": "61 % of the weight on the driven axle, split evenly"
            }
          }
        },
        {
          "id": "el-brake-rl",
          "componentDefId": "mech.brake",
          "label": "Brake RL",
          "position": {
            "x": 40,
            "y": 150
          },
          "parameterOverrides": {}
        },
        {
          "id": "el-vehicle",
          "componentDefId": "vehicle.body",
          "label": "Vehicle",
          "position": {
            "x": 210,
            "y": 40
          },
          "parameterOverrides": {
            "mass_kg": 1927,
            "cd": 0.27,
            "frontal_area_m2": 2.31
          },
          "parameterSources": {
            "mass_kg": {
              "source": "FASTSim 2.1.5 2021_Cupra_Born.csv (Apache-2.0; it cites automobile-catalog.com and carexpert.com.au); docs/data-register.csv DR-01",
              "kind": "datasheet",
              "confidence": 1
            },
            "cd": {
              "source": "FASTSim 2.1.5 2021_Cupra_Born.csv (Apache-2.0; it cites automobile-catalog.com and carexpert.com.au); docs/data-register.csv DR-01",
              "kind": "datasheet",
              "confidence": 1
            },
            "frontal_area_m2": {
              "source": "FASTSim 2.1.5 2021_Cupra_Born.csv (Apache-2.0; it cites automobile-catalog.com and carexpert.com.au); docs/data-register.csv DR-01",
              "kind": "datasheet",
              "confidence": 1
            }
          }
        },
        {
          "id": "el-driver",
          "componentDefId": "driver.driver",
          "label": "Driver",
          "position": {
            "x": 210,
            "y": 150
          },
          "parameterOverrides": {
            "regen_weight_pct": 98
          },
          "parameterSources": {
            "regen_weight_pct": {
              "source": "FASTSim 2.1.5 2021_Cupra_Born.csv (Apache-2.0; it cites automobile-catalog.com and carexpert.com.au); docs/data-register.csv DR-01",
              "kind": "datasheet",
              "confidence": 1,
              "note": "FASTSim's maxRegen"
            }
          }
        },
        {
          "id": "el-veh-monitor",
          "componentDefId": "signal.monitor",
          "label": "Vehicle Monitor",
          "position": {
            "x": 330,
            "y": 40
          },
          "parameterOverrides": {},
          "dynamicPorts": [
            {
              "id": "speed",
              "name": "speed",
              "direction": "input",
              "kind": "signal",
              "unitGroup": "Velocity"
            },
            {
              "id": "motor_torque",
              "name": "motor_torque",
              "direction": "input",
              "kind": "signal",
              "unitGroup": "Torque"
            },
            {
              "id": "traction_cmd",
              "name": "traction_cmd",
              "direction": "input",
              "kind": "signal",
              "unitGroup": "Fraction"
            }
          ]
        },
        {
          "id": "el-brake-fl",
          "componentDefId": "mech.brake",
          "label": "Brake FL",
          "position": {
            "x": 430,
            "y": 130
          },
          "parameterOverrides": {}
        },
        {
          "id": "el-node-fl",
          "componentDefId": "mech.node",
          "label": "Node FL",
          "position": {
            "x": 545,
            "y": 130
          },
          "parameterOverrides": {}
        },
        {
          "id": "el-wheel-fl",
          "componentDefId": "propulsion.wheel",
          "label": "Wheel FL",
          "position": {
            "x": 545,
            "y": 20
          },
          "parameterOverrides": {
            "radius_m": 0.3488,
            "inertia_kgm2": 0.815,
            "rolling_resistance": 0.011,
            "vehicle_load_share_pct": 30.5,
            "axle": "Front"
          },
          "parameterSources": {
            "radius_m": {
              "source": "FASTSim 2.1.5 2021_Cupra_Born.csv (Apache-2.0; it cites automobile-catalog.com and carexpert.com.au); docs/data-register.csv DR-01",
              "kind": "datasheet",
              "confidence": 1
            },
            "inertia_kgm2": {
              "source": "FASTSim 2.1.5 2021_Cupra_Born.csv (Apache-2.0; it cites automobile-catalog.com and carexpert.com.au); docs/data-register.csv DR-01",
              "kind": "datasheet",
              "confidence": 1
            },
            "rolling_resistance": {
              "source": "FASTSim 2.1.5 2021_Cupra_Born.csv (Apache-2.0; it cites automobile-catalog.com and carexpert.com.au); docs/data-register.csv DR-01",
              "kind": "datasheet",
              "confidence": 1
            },
            "vehicle_load_share_pct": {
              "source": "FASTSim 2.1.5 2021_Cupra_Born.csv (Apache-2.0; it cites automobile-catalog.com and carexpert.com.au); docs/data-register.csv DR-01",
              "kind": "datasheet",
              "confidence": 1,
              "note": "61 % of the weight on the driven axle, split evenly"
            }
          }
        },
        {
          "id": "el-hvbus",
          "componentDefId": "electric.node",
          "label": "HV Bus",
          "position": {
            "x": 200,
            "y": 250
          },
          "parameterOverrides": {}
        },
        {
          "id": "el-battery",
          "componentDefId": "battery.generic",
          "label": "HV Battery Pack",
          "position": {
            "x": 40,
            "y": 385
          },
          "parameterOverrides": {
            "capacity_kWh": 62,
            "min_soc_pct": 4
          },
          "parameterSources": {
            "capacity_kWh": {